{
  "$schema": "https://json-schema.org/draft/2020-12/schema",
  "$id": "https://write-on-mars.dev/contracts/manifest/v1.4.0.json",
  "$comment": "ÚNICA fuente editable desde 2026-07-04 (contracts/ raíz y specs/001 son punteros). v1.1 (MINOR, feature 003-atribucion-factualidad): adds optional quality_gates. v1.2 (MINOR, 2026-07-04, pirámide de prosa): adds optional sector and registro; sector already era escrito por speckit.constitution pero no estaba declarado (con additionalProperties:false el manifiesto no validaba). v1.2.1 (PATCH, 2026-07-04): sector admite null (bootstrap escribe null hasta que speckit.constitution lo fija; un proyecto recién creado no validaba). v1.3 (MINOR, feature 004-vivarium-core): adds optional mode and mode_history (constitución v1.6.0 § Modos de proyecto; ausencia de mode = produccion). v1.4 (MINOR, feature 006-pista-corta-editorial): adds optional track and track_history (constitución v1.7.0 § Pistas de ceremonia; ausencia de track = estandar). track_history registra `actor` humano, a diferencia de mode_history: el escalado de pista exige identidad humana auditable (scripts/track.py).",
  "title": "Write.OnMars Project Manifest v1.4.0",
  "description": "Manifest declared by every editorial project that uses the Write.OnMars harness. Produced by `writeonmars-install` (FR-001..FR-004) and updated when versions, signing matrix or operators change.",
  "type": "object",
  "required": [
    "framework_version",
    "constitution_version",
    "agent_target",
    "language_primary",
    "skills",
    "research_mode",
    "signing_matrix",
    "human_operators",
    "citation_contract_version"
  ],
  "additionalProperties": false,
  "properties": {
    "framework_version": {
      "type": "string",
      "pattern": "^\\d+\\.\\d+\\.\\d+$",
      "description": "Semver of the Write.OnMars framework installed in this project."
    },
    "constitution_version": {
      "type": "string",
      "pattern": "^\\d+\\.\\d+\\.\\d+$",
      "description": "Semver of the constitution under which the project operates."
    },
    "agent_target": {
      "type": "string",
      "enum": ["claude-code", "codex", "cursor", "other"],
      "description": "Primary agent used to operate the framework. v1 prioritises claude-code."
    },
    "language_primary": {
      "type": "string",
      "pattern": "^[a-z]{2}(-[A-Z]{2})?$",
      "description": "ISO-639 + optional region. Default 'es'."
    },
    "skills": {
      "type": "array",
      "minItems": 1,
      "items": {
        "type": "object",
        "required": ["name", "version", "source"],
        "additionalProperties": false,
        "properties": {
          "name": {"type": "string", "minLength": 1},
          "version": {"type": "string", "pattern": "^\\d+\\.\\d+\\.\\d+$"},
          "source": {"type": "string", "enum": ["bundled", "external"]},
          "path": {"type": "string", "description": "Optional explicit path when symlinked or relocated."}
        }
      },
      "description": "Skills enabled in the project. Bundled = shipped by Write.OnMars (e.g. /marcela-prose, /technical-guide-design, writeonmars-*). External = installed by the operator from another source."
    },
    "research_mode": {
      "type": "string",
      "enum": ["byom", "bundled"],
      "description": "byom = the project relies on external MCPs that comply with the citation contract (default v1). bundled = the project activates writeonmars-research as the canonical research+contrast MCP."
    },
    "signing_matrix": {
      "type": "object",
      "required": [
        "pasada_1_estructura",
        "pasada_2_utilidad",
        "pasada_3_naturalidad",
        "pasada_4_precision",
        "pasada_5_formato"
      ],
      "additionalProperties": false,
      "properties": {
        "pasada_1_estructura": {"$ref": "#/$defs/signingPolicy"},
        "pasada_2_utilidad": {"$ref": "#/$defs/signingPolicy"},
        "pasada_3_naturalidad": {"$ref": "#/$defs/signingPolicy"},
        "pasada_4_precision": {"$ref": "#/$defs/signingPolicy"},
        "pasada_5_formato": {"$ref": "#/$defs/signingPolicy"}
      },
      "description": "Per-pass signing policy. v1 default: pasadas 1, 2, 5 = autonomous; pasadas 3, 4 = human."
    },
    "human_operators": {
      "type": "array",
      "minItems": 1,
      "items": {
        "type": "object",
        "required": ["id", "role"],
        "additionalProperties": false,
        "properties": {
          "id": {"type": "string", "minLength": 1, "description": "Stable identifier used in pass signatures."},
          "email": {"type": "string", "format": "email"},
          "role": {"type": "string", "enum": ["editor", "author", "reviewer", "maintainer"]}
        }
      },
      "description": "Humans authorised to sign passes flagged as 'human' in signing_matrix."
    },
    "citation_contract_version": {
      "type": "string",
      "pattern": "^\\d+\\.\\d+$",
      "description": "Citation contract version this project supports. Records emitted by MCPs are validated against this version."
    },
    "sector": {
      "type": ["string", "null"],
      "pattern": "^[a-z0-9]+(-[a-z0-9]+)*$",
      "description": "Optional. Slug of the sector base applied to the project addenda (references/sectores/<slug>.md). Written by speckit.constitution; null until then (bootstrap default)."
    },
    "mode": {
      "type": "string",
      "enum": ["produccion", "estudio"],
      "description": "Modo de trabajo del proyecto (constitución v1.6.0 § Modos de proyecto). Ausencia = produccion. produccion: la IA redacta anclada en fuentes. estudio: el humano escribe; la IA no redacta prosa del manuscrito."
    },
    "mode_history": {
      "type": "array",
      "description": "Registro append-only de cambios de modo. Cada cambio lo escribe una acción humana explícita (vivarium mode set --yes o edición manual documentada).",
      "items": {
        "type": "object",
        "required": ["from", "to", "date"],
        "additionalProperties": false,
        "properties": {
          "from": {"type": "string", "enum": ["produccion", "estudio"]},
          "to": {"type": "string", "enum": ["produccion", "estudio"]},
          "date": {"type": "string", "format": "date-time"}
        }
      }
    },
    "track": {
      "type": "string",
      "enum": ["estandar", "corta"],
      "description": "Pista de ceremonia del proyecto (constitución v1.7.0 § Pistas de ceremonia). Ausencia = estandar. estandar: ceremonia completa (temario multi-capítulo, 3 pasadas locales + 1 global, intro). corta: pieza única (temario degenerado de una fila, pasada combinada 1·2·3·5 + precisión 4, sin intro). Ortogonal a `mode`."
    },
    "track_history": {
      "type": "array",
      "description": "Registro append-only de cambios de pista. Lo escribe EXCLUSIVAMENTE scripts/track.py, que exige identidad humana desde git config y rechaza identidades de agente. Nunca se edita a mano.",
      "items": {
        "type": "object",
        "required": ["from", "to", "date", "actor"],
        "additionalProperties": false,
        "properties": {
          "from": {"type": "string", "enum": ["estandar", "corta"]},
          "to": {"type": "string", "enum": ["estandar", "corta"]},
          "date": {"type": "string", "format": "date-time"},
          "actor": {"type": "string", "minLength": 1, "description": "git config user.name del humano que ejecutó el cambio."},
          "email": {"type": "string", "format": "email"}
        }
      }
    },
    "registro": {
      "type": "string",
      "pattern": "^[a-z0-9]+(-[a-z0-9]+)*$",
      "description": "Optional. Slug of the prose register (layer 2 of the prose pyramid) applied to the guide (references/registros/<slug>/SKILL.md). Written by speckit.constitution; defaults to the sector's proposed register when absent."
    },
    "project_type": {
      "type": "string",
      "enum": ["editorial", "software", "mixed"],
      "description": "Optional. Selects the mode of `.specify/templates/*` consumed by Spec Kit. `editorial` activates the brief of nine fields, the temario / descripciones encadenadas, the five-pasada checklist materialisation and the editorial Constitution Check. `software` keeps the classic Spec Kit behaviour. `mixed` renders both. Default behaviour when absent: software."
    },
    "memory_external": {
      "type": "object",
      "additionalProperties": false,
      "description": "Optional vector memory configuration. Cache only; never source of truth (constitution § Arquitectura del framework).",
      "properties": {
        "enabled": {"type": "boolean", "default": false},
        "provider": {"type": "string"},
        "uri": {"type": "string"},
        "rebuildable_from_repo": {"type": "boolean", "const": true}
      }
    },
    "writeonmars_research_module": {
      "type": "object",
      "additionalProperties": false,
      "description": "Optional bundled MCP module activation (FR-009b).",
      "properties": {
        "enabled": {"type": "boolean", "default": false},
        "version": {"type": "string", "pattern": "^\\d+\\.\\d+\\.\\d+$"}
      }
    },
    "quality_gates": {
      "type": "object",
      "additionalProperties": false,
      "description": "Optional quality gates beyond criticals/signatures/completeness (feature 003-atribucion-factualidad). Cache de política, no fuente de verdad. Cuando se omite, status.py se comporta como en v1.0 (gates g1·g2·g3).",
      "properties": {
        "factuality_min": {"type": "number", "minimum": 0, "maximum": 1, "description": "Piso del índice de factualidad global para cerrar (g4)."},
        "factuality_min_per_chapter": {"type": "number", "minimum": 0, "maximum": 1, "description": "Piso por capítulo medido (opcional)."},
        "factuality_mode": {"type": "string", "enum": ["advisory", "blocking"], "default": "blocking", "description": "advisory = informa pero no bloquea closeable; blocking = g4 entra en closeable."}
      }
    }
  },
  "$defs": {
    "signingPolicy": {
      "type": "string",
      "enum": ["autonomous", "human"],
      "description": "autonomous = pass closes when checklist is green. human = an operator listed in human_operators must sign."
    }
  }
}
